SQL> CREATE TABLE STUDENT_1948(Roll NUMBER(3), Name VARCHAR2(10), City VARCHAR(15), Age NUMBER(2), CGPA NUMBER(4,2));

Table created.

SQL> INSERT INTO STUDENT_1948 VALUES(101, 'Ram', 'Bhubaneswar', 19, 6.44);

1 row created.

SQL> INSERT INTO STUDENT_1948 VALUES(102, 'Hari', 'Jharkhand', 20, 10);

1 row created.

SQL> INSERT INTO STUDENT_1948 VALUES(103, 'Uday', 'Bhubaneswar', 19, 9.9);

1 row created.

SQL> INSERT INTO STUDENT_1948 VALUES(104, 'Vikas', 'Uttar Pradesh', 20, 3.56);

1 row created.

SQL> INSERT INTO STUDENT_1948 VALUES(105, 'Sweta', 'Rajasthan', 19, 6);

1 row created.

SQL> INSERT INTO STUDENT_1948 VALUES(106, 'Arnav', 'Delhi', 20, 5.67);

1 row created.

SQL> INSERT INTO STUDENT_1948 VALUES(107, 'Swadhin', 'Cuttack', 19, 8.6);

1 row created.

SQL> INSERT INTO STUDENT_1948 VALUES(108, 'Yogesh', 'Kolkata', 19, 7.08);

1 row created.

SQL> INSERT INTO STUDENT_1948 VALUES(109, 'Smriti', 'Chennai', 20, 6.97);

1 row created.

SQL> INSERT INTO STUDENT_1948 VALUES(110, 'Manish', 'Ranchi', 20, 5.28);

1 row created.

SQL> SELECT * from STUDENT_1948;

      ROLL NAME       CITY                   AGE       CGPA                     
---------- ---------- --------------- ---------- ----------                     
       101 Ram        Bhubaneswar             19       6.44                     
       102 Hari       Jharkhand               20         10                     
       103 Uday       Bhubaneswar             19        9.9                     
       104 Vikas      Uttar Pradesh           20       3.56                     
       105 Sweta      Rajasthan               19          6                     
       106 Arnav      Delhi                   20       5.67                     
       107 Swadhin    Cuttack                 19        8.6                     
       108 Yogesh     Kolkata                 19       7.08                     
       109 Smriti     Chennai                 20       6.97                     
       110 Manish     Ranchi                  20       5.28                     

10 rows selected.

SQL> ACCEPT Roll PROMPT 'Please enter the Roll of Student:'
Please enter the Roll of Student:101
SQL> SELECT * from STUDENT_1948;

      ROLL NAME       CITY                   AGE       CGPA                     
---------- ---------- --------------- ---------- ----------                     
       101 Ram        Bhubaneswar             19       6.44                     
       102 Hari       Jharkhand               20         10                     
       103 Uday       Bhubaneswar             19        9.9                     
       104 Vikas      Uttar Pradesh           20       3.56                     
       105 Sweta      Rajasthan               19          6                     
       106 Arnav      Delhi                   20       5.67                     
       107 Swadhin    Cuttack                 19        8.6                     
       108 Yogesh     Kolkata                 19       7.08                     
       109 Smriti     Chennai                 20       6.97                     
       110 Manish     Ranchi                  20       5.28                     

10 rows selected.

SQL> SELECT ROLL, NAME, CGPA from STUDENT_1948;

      ROLL NAME             CGPA                                                
---------- ---------- ----------                                                
       101 Ram              6.44                                                
       102 Hari               10                                                
       103 Uday              9.9                                                
       104 Vikas            3.56                                                
       105 Sweta               6                                                
       106 Arnav            5.67                                                
       107 Swadhin           8.6                                                
       108 Yogesh           7.08                                                
       109 Smriti           6.97                                                
       110 Manish           5.28                                                

10 rows selected.

SQL> SELECT ROLL, NAME, CGPA+1 as UPDATED_CGPA from STUDENT_1948;

      ROLL NAME       UPDATED_CGPA                                              
---------- ---------- ------------                                              
       101 Ram                7.44                                              
       102 Hari                 11                                              
       103 Uday               10.9                                              
       104 Vikas              4.56                                              
       105 Sweta                 7                                              
       106 Arnav              6.67                                              
       107 Swadhin             9.6                                              
       108 Yogesh             8.08                                              
       109 Smriti             7.97                                              
       110 Manish             6.28                                              

10 rows selected.

SQL> SELECT DISTINCT AGE from STUDENT_1948;

       AGE                                                                      
----------                                                                      
        20                                                                      
        19                                                                      

SQL> SELECT ROLL||' '||UPDATED_CGPA from STUDENT_1948;
SELECT ROLL||' '||UPDATED_CGPA from STUDENT_1948
                  *
ERROR at line 1:
ORA-00904: "UPDATED_CGPA": invalid identifier 


SQL> SELECT ROLL||' '||CGPA from STUDENT_1948;

ROLL||''||CGPA                                                                  
--------------------------------------------------------------------------------
101 6.44                                                                        
102 10                                                                          
103 9.9                                                                         
104 3.56                                                                        
105 6                                                                           
106 5.67                                                                        
107 8.6                                                                         
108 7.08                                                                        
109 6.97                                                                        
110 5.28                                                                        

10 rows selected.

SQL> SELECT ROLL||' '||CGPA as "MARKSHEET" from STUDENT_1948;

MARKSHEET                                                                       
--------------------------------------------------------------------------------
101 6.44                                                                        
102 10                                                                          
103 9.9                                                                         
104 3.56                                                                        
105 6                                                                           
106 5.67                                                                        
107 8.6                                                                         
108 7.08                                                                        
109 6.97                                                                        
110 5.28                                                                        

10 rows selected.

SQL> SELECT * from STUDENT_1948 where CGPA>=8;

      ROLL NAME       CITY                   AGE       CGPA                     
---------- ---------- --------------- ---------- ----------                     
       102 Hari       Jharkhand               20         10                     
       103 Uday       Bhubaneswar             19        9.9                     
       107 Swadhin    Cuttack                 19        8.6                     

SQL> SELECT ROLL, NAME, CGPA from STUDENT_1948 where CGPA>=8;

      ROLL NAME             CGPA                                                
---------- ---------- ----------                                                
       102 Hari               10                                                
       103 Uday              9.9                                                
       107 Swadhin           8.6                                                

SQL> SELECT ROLL, NAME, AGE, CGPA from STUDENT_1948 where CGPA>=8 and AGE>=20;

      ROLL NAME              AGE       CGPA                                     
---------- ---------- ---------- ----------                                     
       102 Hari               20         10                                     

SQL> SELECT ROLL, NAME, AGE, CGPA from STUDENT_1948 where CGPA>=8 or AGE>=20;

      ROLL NAME              AGE       CGPA                                     
---------- ---------- ---------- ----------                                     
       102 Hari               20         10                                     
       103 Uday               19        9.9                                     
       104 Vikas              20       3.56                                     
       106 Arnav              20       5.67                                     
       107 Swadhin            19        8.6                                     
       109 Smriti             20       6.97                                     
       110 Manish             20       5.28                                     

7 rows selected.

SQL> SELECT * from STUDENT_1948 where NAME LIKE 'S%';

      ROLL NAME       CITY                   AGE       CGPA                     
---------- ---------- --------------- ---------- ----------                     
       105 Sweta      Rajasthan               19          6                     
       107 Swadhin    Cuttack                 19        8.6                     
       109 Smriti     Chennai                 20       6.97                     

SQL> SELECT * from STUDENT_1948 where NAME LIKE 'S_';

no rows selected

SQL> SELECT * from STUDENT_1948 where NAME LIKE 'S ';

no rows selected

SQL> SELECT * from STUDENT_1948 where NAME LIKE '%i% ';

no rows selected

SQL> SELECT * from STUDENT_1948 where NAME LIKE '%i%';

      ROLL NAME       CITY                   AGE       CGPA                     
---------- ---------- --------------- ---------- ----------                     
       102 Hari       Jharkhand               20         10                     
       104 Vikas      Uttar Pradesh           20       3.56                     
       107 Swadhin    Cuttack                 19        8.6                     
       109 Smriti     Chennai                 20       6.97                     
       110 Manish     Ranchi                  20       5.28                     

SQL> SELECT * from STUDENT_1948 where NAME LIKE '%d%';

      ROLL NAME       CITY                   AGE       CGPA                     
---------- ---------- --------------- ---------- ----------                     
       103 Uday       Bhubaneswar             19        9.9                     
       107 Swadhin    Cuttack                 19        8.6                     

SQL> SELECT * from STUDENT_1948 where NAME LIKE '%n';

      ROLL NAME       CITY                   AGE       CGPA                     
---------- ---------- --------------- ---------- ----------                     
       107 Swadhin    Cuttack                 19        8.6                     

SQL> SELECT * from STUDENT_1948 where ROLL IN (101,105,109);

      ROLL NAME       CITY                   AGE       CGPA                     
---------- ---------- --------------- ---------- ----------                     
       101 Ram        Bhubaneswar             19       6.44                     
       105 Sweta      Rajasthan               19          6                     
       109 Smriti     Chennai                 20       6.97                     

SQL> SELECT * from STUDENT_1948 where AGE LIKE BETWEEN 20 and 22;
SELECT * from STUDENT_1948 where AGE LIKE BETWEEN 20 and 22
                                          *
ERROR at line 1:
ORA-00936: missing expression 


SQL> SELECT * from STUDENT_1948 where AGE LIKE BETWEEN 18 and 22;
SELECT * from STUDENT_1948 where AGE LIKE BETWEEN 18 and 22
                                          *
ERROR at line 1:
ORA-00936: missing expression 


SQL> SELECT * from STUDENT_1948 where AGE BETWEEN 18 and 22;

      ROLL NAME       CITY                   AGE       CGPA                     
---------- ---------- --------------- ---------- ----------                     
       101 Ram        Bhubaneswar             19       6.44                     
       102 Hari       Jharkhand               20         10                     
       103 Uday       Bhubaneswar             19        9.9                     
       104 Vikas      Uttar Pradesh           20       3.56                     
       105 Sweta      Rajasthan               19          6                     
       106 Arnav      Delhi                   20       5.67                     
       107 Swadhin    Cuttack                 19        8.6                     
       108 Yogesh     Kolkata                 19       7.08                     
       109 Smriti     Chennai                 20       6.97                     
       110 Manish     Ranchi                  20       5.28                     

10 rows selected.

SQL> SELECT * from STUDENT_1948 where AGE is NULL;

no rows selected

SQL> SELECT * from STUDENT_1948 order by AGE DESC;

      ROLL NAME       CITY                   AGE       CGPA                     
---------- ---------- --------------- ---------- ----------                     
       109 Smriti     Chennai                 20       6.97                     
       104 Vikas      Uttar Pradesh           20       3.56                     
       102 Hari       Jharkhand               20         10                     
       106 Arnav      Delhi                   20       5.67                     
       110 Manish     Ranchi                  20       5.28                     
       108 Yogesh     Kolkata                 19       7.08                     
       107 Swadhin    Cuttack                 19        8.6                     
       103 Uday       Bhubaneswar             19        9.9                     
       101 Ram        Bhubaneswar             19       6.44                     
       105 Sweta      Rajasthan               19          6                     

10 rows selected.

SQL> SELECT * from STUDENT_1948 order by CGPA DESC;

      ROLL NAME       CITY                   AGE       CGPA                     
---------- ---------- --------------- ---------- ----------                     
       102 Hari       Jharkhand               20         10                     
       103 Uday       Bhubaneswar             19        9.9                     
       107 Swadhin    Cuttack                 19        8.6                     
       108 Yogesh     Kolkata                 19       7.08                     
       109 Smriti     Chennai                 20       6.97                     
       101 Ram        Bhubaneswar             19       6.44                     
       105 Sweta      Rajasthan               19          6                     
       106 Arnav      Delhi                   20       5.67                     
       110 Manish     Ranchi                  20       5.28                     
       104 Vikas      Uttar Pradesh           20       3.56                     

10 rows selected.

SQL> SELECT * from STUDENT_1948 ORDER BY 4 DESC;

      ROLL NAME       CITY                   AGE       CGPA                     
---------- ---------- --------------- ---------- ----------                     
       109 Smriti     Chennai                 20       6.97                     
       104 Vikas      Uttar Pradesh           20       3.56                     
       102 Hari       Jharkhand               20         10                     
       106 Arnav      Delhi                   20       5.67                     
       110 Manish     Ranchi                  20       5.28                     
       108 Yogesh     Kolkata                 19       7.08                     
       107 Swadhin    Cuttack                 19        8.6                     
       103 Uday       Bhubaneswar             19        9.9                     
       101 Ram        Bhubaneswar             19       6.44                     
       105 Sweta      Rajasthan               19          6                     

10 rows selected.

SQL> ALTER TABLE STUDENT_1948 ADD (BRANCH VARCHAR2(5));

Table altered.

SQL> SELECT * from STUDENT_1948;

      ROLL NAME       CITY                   AGE       CGPA BRANC               
---------- ---------- --------------- ---------- ---------- -----               
       101 Ram        Bhubaneswar             19       6.44                     
       102 Hari       Jharkhand               20         10                     
       103 Uday       Bhubaneswar             19        9.9                     
       104 Vikas      Uttar Pradesh           20       3.56                     
       105 Sweta      Rajasthan               19          6                     
       106 Arnav      Delhi                   20       5.67                     
       107 Swadhin    Cuttack                 19        8.6                     
       108 Yogesh     Kolkata                 19       7.08                     
       109 Smriti     Chennai                 20       6.97                     
       110 Manish     Ranchi                  20       5.28                     

10 rows selected.

SQL> ALTER TABLE STUDENT_1948 DROP COLUMN BRANCH;

Table altered.

SQL> SELECT * from STUDENT_1948;

      ROLL NAME       CITY                   AGE       CGPA                     
---------- ---------- --------------- ---------- ----------                     
       101 Ram        Bhubaneswar             19       6.44                     
       102 Hari       Jharkhand               20         10                     
       103 Uday       Bhubaneswar             19        9.9                     
       104 Vikas      Uttar Pradesh           20       3.56                     
       105 Sweta      Rajasthan               19          6                     
       106 Arnav      Delhi                   20       5.67                     
       107 Swadhin    Cuttack                 19        8.6                     
       108 Yogesh     Kolkata                 19       7.08                     
       109 Smriti     Chennai                 20       6.97                     
       110 Manish     Ranchi                  20       5.28                     

10 rows selected.

SQL> ALTER TABLE STUDENT_1948 MODIFY AGE VARCHAR2(5));
ALTER TABLE STUDENT_1948 MODIFY AGE VARCHAR2(5))
                                               *
ERROR at line 1:
ORA-01735: invalid ALTER TABLE option 


SQL> ALTER TABLE STUDENT_1948 MODIFY (AGE VARCHAR2(5));
ALTER TABLE STUDENT_1948 MODIFY (AGE VARCHAR2(5))
                                 *
ERROR at line 1:
ORA-01439: column to be modified must be empty to change datatype 


SQL> ALTER TABLE STUDENT_1948 MODIFY AGE NUMBER(6);

Table altered.

SQL> DESC TABLE STUDENT_1948;
Usage: DESCRIBE [schema.]object[@db_link]
SQL> DESCRIBE TABLE STUDENT_1948;
Usage: DESCRIBE [schema.]object[@db_link]
SQL> DESC STUDENT_1948;
 Name                                      Null?    Type
 ----------------------------------------- -------- ----------------------------
 ROLL                                               NUMBER(3)
 NAME                                               VARCHAR2(10)
 CITY                                               VARCHAR2(15)
 AGE                                                NUMBER(6)
 CGPA                                               NUMBER(4,2)

SQL> ALTER TABLE STUDENT_1948 RENAME NAME to NAMES;
ALTER TABLE STUDENT_1948 RENAME NAME to NAMES
                                *
ERROR at line 1:
ORA-14155: missing PARTITION or SUBPARTITION keyword 


SQL> UPDATE STUDENT_1948 SET CGPA=8.0 where ROLL=104;

1 row updated.

SQL> ALTER TABLE STUDENT_1948 RENAME column NAME to NAMES;

Table altered.

SQL> SELECT * from STUDENT_1948;

      ROLL NAMES      CITY                   AGE       CGPA                     
---------- ---------- --------------- ---------- ----------                     
       101 Ram        Bhubaneswar             19       6.44                     
       102 Hari       Jharkhand               20         10                     
       103 Uday       Bhubaneswar             19        9.9                     
       104 Vikas      Uttar Pradesh           20          8                     
       105 Sweta      Rajasthan               19          6                     
       106 Arnav      Delhi                   20       5.67                     
       107 Swadhin    Cuttack                 19        8.6                     
       108 Yogesh     Kolkata                 19       7.08                     
       109 Smriti     Chennai                 20       6.97                     
       110 Manish     Ranchi                  20       5.28                     

10 rows selected.

SQL> ALTER TABLE STUDENT_1948 ADD (BRANCH VARCHAR2(7));

Table altered.

SQL> SELECT * from STUDENT_1948;

      ROLL NAMES      CITY                   AGE       CGPA BRANCH              
---------- ---------- --------------- ---------- ---------- -------             
       101 Ram        Bhubaneswar             19       6.44                     
       102 Hari       Jharkhand               20         10                     
       103 Uday       Bhubaneswar             19        9.9                     
       104 Vikas      Uttar Pradesh           20          8                     
       105 Sweta      Rajasthan               19          6                     
       106 Arnav      Delhi                   20       5.67                     
       107 Swadhin    Cuttack                 19        8.6                     
       108 Yogesh     Kolkata                 19       7.08                     
       109 Smriti     Chennai                 20       6.97                     
       110 Manish     Ranchi                  20       5.28                     

10 rows selected.

SQL> spool off;
